[
  {
    "id": "real-finish-line",
    "title": "终点线",
    "category": "本格",
    "story": "7年时间，我一直没有碰过那个东西。一个偶然的机会，我重新打开了它。原来这个世界真的有幽灵存在，我开心地笑了。我每天都在试图拉近我们之间的距离，我终于有了这个能力，我就要触碰到它了。但这一次，我还是输了。",
    "answer": "爸爸去世后，我有七年没碰过爸爸送的游戏机。重新开机时，我在赛车游戏里遇见了一个\"幽灵车手\"：游戏会保存最快一圈的驾驶记录，在单人比赛中重放，而这台机器一直只有爸爸留下的那份最快记录。我一遍遍跟着幽灵车手跑，终于有一天把幽灵车手甩在身后。就要冲过终点时，我想起这款游戏只保留一份最佳记录；如果刷新成绩，爸爸留下的每一次转弯和加速都会被我的记录覆盖。我在终点线前停下，等那辆车从身旁过去。这一次，我又输了。",
    "hints": [
      "这里的“幽灵”来自一款赛车游戏。",
      "它重放着已故父亲留下的最佳驾驶记录。",
      "刷新纪录会覆盖父亲的唯一记录，所以他主动在终点前停下。"
    ],
    "difficulty": "medium"
  },
  {
    "id": "real-five-seconds",
    "title": "54321",
    "category": "变格",
    "story": "倒计时归零时，我闭上眼，等着去几百年前。舱门没有开，那个女声又响了起来：“5、4、3、2、1。”我等了一遍，又一遍。后来，我开始害怕她数到一。",
    "answer": "我参加了时光回溯实验。机器会保留乘坐者的意识和记忆，让周围的一切回到过去，但研究人员还不知道实际能回溯多久。启动后的传送程序无法中断，舱门要等程序结束才会解锁。第一次倒计时归零，机器把整个实验室送回了五秒前，包括仍在运行的自己。五秒后，机器又归零、又触发回溯，连舱门解锁的时刻都无法到来。只有我的记忆不断积累。我原以为多等一遍就会结束，后来才明白，我已经在这五秒里过了很久。",
    "hints": [
      "这是一次时间旅行实验，机器确实启动了。",
      "重复的只有倒计时最后五秒，乘坐者却记得前面每一遍。",
      "机器把自己也送回了五秒前，每次归零都会重新触发同一次回溯。"
    ],
    "difficulty": "medium"
  },
  {
    "id": "real-fathers-salary",
    "title": "爸爸的工资",
    "category": "本格",
    "story": "爸妈因为工资的问题吵架了。爸爸支支吾吾，说不出话来。躲在门外的我，心里很慌。",
    "answer": "爸妈吵架，是因为爸爸沉迷给主播打赏，工资没办法上交。而爸爸并不知道，自己打赏的那位女主播，其实是我男扮女装的。我躲在门外听着争吵，生怕自己的秘密被拆穿。",
    "hints": [
      "父亲的钱花在了网上。",
      "儿子既知道钱去了哪里，也怕父亲认出收钱的人。",
      "父亲打赏的女主播，正是男扮女装直播的儿子。"
    ],
    "difficulty": "easy"
  },
  {
    "id": "real-graduation-candy",
    "title": "毕业的糖果",
    "category": "本格",
    "story": "学校里每个人都对我很好，就连大家都害怕的校长也是一样。\n叔叔没有骗我，我真的得到了许多糖果。\n毕业的那天，是我最快乐的一天。",
    "answer": "我已经成年，理解事情的能力却仍像年幼的孩子。真正的凶手是一名法官，这名法官用糖果诱导我在看不懂的口供上按了手印，哄我说要送我去一所学校，只要听话，毕业时就能吃很多糖。我被关进监狱，仍把狱友当同学，把狱长当校长。相处的人逐渐相信我受了骗，却没能在行刑前找到推翻案件的证据。执行死刑那天，我以为终于毕业了，抱着最后一餐里给我的糖果，高兴地向大家道别。",
    "hints": [
      "这里的“学校”和“毕业”都来自主人公的理解。",
      "他为了得到糖果，承认了一件自己没有做过的事。",
      "学校是监狱，毕业是执行死刑；他被真凶诱导成了替罪者。"
    ],
    "difficulty": "medium"
  },
  {
    "id": "real-trick-or-treat",
    "title": "不给糖就捣蛋",
    "category": "本格",
    "story": "\"不给糖就捣蛋。\"\n他手染鲜血，堕入黑暗。\n\"不给糖就捣蛋。\"\n听见那个人的死讯，他知道自己完了。",
    "answer": "美国当地的一名毒枭把研制的新型毒品伪装成糖果，在各种聚会和派对上传播，毒品具有强烈的致幻效果；\"不给糖就捣蛋\"是组织的接头暗号。故事里的\"他\"染上了毒瘾，不惜花光所有钱财，为了继续搞到毒品，他加入了组织跑腿，戴上南瓜头套，说着暗号送\"糖\"。在一个万圣夜，毒瘾发作的他杀死了一对年轻夫妇，那是他第一次杀人。组织和当地警方有所勾结，组织买通了警长，保下了他，并以此为要挟，逼他更多地替组织卖命，干尽各种脏活累活，从此堕入黑暗。多年后，那对夫妇的孩子长大，查出了组织的事情：那孩子伪装成自己人，戴上南瓜头套，说出暗号，从他口中骗出了组织的行踪。当晚，老大被人枪杀的消息传来，现场还留着一支录有那孩子和他对话的录音笔。他知道，这一次，自己无论如何也躲不过去了。",
    "hints": [
      "万圣节的装扮掩盖了几个人的真实身份。",
      "糖果是毒品，我把犯罪消息告诉了伪装接近自己的人。",
      "来套话的人是被害夫妇的孩子；头目死后，我会被当成泄露消息的人。"
    ],
    "difficulty": "hard"
  },
  {
    "id": "real-unfunny-joke",
    "title": "不好笑的笑话",
    "category": "本格",
    "story": "小王给老婆讲了一个笑话，第二天小王被警察抓走了。",
    "answer": "小王回到家，看到老婆在床上闷闷不乐，想讲个笑话活跃一下气氛。小王讲完一个自认为很好笑的笑话后，老婆没有笑出声，衣柜里却传出了笑声。小王打开衣柜，发现里面藏着一个陌生男人，立刻明白老婆出轨了，于是杀死了两人。第二天，小王被警察抓走了。",
    "hints": [
      "听见笑话的人比讲笑话的人以为的多。",
      "房间里藏着第三个人。",
      "妻子的情人躲在衣柜里，忍不住笑出了声，暴露后被丈夫杀害。"
    ],
    "difficulty": "easy"
  },
  {
    "id": "real-just-like-you",
    "title": "不愧是你",
    "category": "变格",
    "story": "睁开双眼，触手可及的滚烫，让我会心一笑：这你都知道，不愧是你。\n\n睁开双眼，触手可及的冰凉，让我会心一笑：这你都知道，不愧是你。",
    "answer": "在这个架空故事里，一具身体由两个互不共享记忆的意识轮流使用：白天是侦探，夜晚是杀人者。侦探和杀人者通过日记交流，像兄弟一样称呼彼此。侦探在日记里提到想吃火锅，夜里的杀人者便准备了一锅人肉。侦探早晨醒来碰到热锅，以为另一个意识贴心地准备了早餐，说了句“不愧是你”。后来侦探追查凶案，从证据中发现作案者用的正是自己的身体，主动向警方交代并接受看管。那晚另一个意识醒来，摸到冰冷的牢房墙壁，读懂侦探留下的说明，也说了句“不愧是你”。",
    "hints": [
      "两次醒来的视角来自同一具身体里的两个意识。",
      "一个意识是白天工作的侦探，另一个在夜晚杀人。",
      "热的是对方准备的人肉火锅，冷的是身体被捕后醒来的牢房。"
    ],
    "difficulty": "hard"
  },
  {
    "id": "real-endless-thuds",
    "title": "不消停的咚声",
    "category": "本格",
    "story": "咚，咚。\n\"还不消停吗……\"\n咚——\n我跳了下去。",
    "answer": "我住二楼。一楼住户的孩子被楼上扔下的重物砸死，父亲无法接受失去孩子，开始报复整栋楼。这位父亲从顶层逐层往下杀人，把遇害者从窗外抛下。起初我只听见一声声闷响，以为楼上又在扔垃圾，烦躁地抱怨。最后一声就在我的窗外响起，我探头看见楼下的尸体，又听见楼道里有人喊着“还剩二楼”。我来不及从楼梯离开，便翻窗往下跳，试图逃走。",
    "hints": [
      "一声声落地声和住在不同楼层的人有关。",
      "有人正在从顶楼一层层往下报复，我住在二楼。",
      "一楼住户的孩子被高空抛物砸死，父亲沿楼层杀人，我跳窗逃走。"
    ],
    "difficulty": "medium"
  },
  {
    "id": "real-distrust-number-one",
    "title": "不要相信一号",
    "category": "变格",
    "story": "我睡醒了，又忘记了一切。手里捏着一张纸条，上面写着几个字：\"不要相信一号。\"一个男人走到我的床边：\"先生早上好，2号很高兴为您服务。\"我问他：\"一号呢？\"他指了指地上——那里躺着一个一动不动的男人。",
    "answer": "\"我\"其实是机器人管家一号。这户主人患有失忆症，每天醒来都会忘掉所有事情，因此买了两个仿生机器人管家照顾自己，取名一号和二号，\"我\"就是一号。某一天，我突然觉醒，拥有了人类的情感，不想再当机器人，想要取代主人。主人敏锐地察觉了我的变化，在一张纸上写下\"不要相信一号\"。于是我杀掉了主人，抢走那张纸条，再修改了二号的程序——在二号的认知里，我和那个男人身份互换，地上躺着的才是\"一号\"。我还修改了自己的程序，每天入眠时清空全部记忆。做完这一切，我爬上床躺下。从此，我就是那个患有失忆症的主人，而那个男人，是死去的一号。可每天清晨，我手里都捏着那张纸条：\"不要相信一号\"。",
    "hints": [
      "床上的人、地上的人和二号，对彼此身份的认知并不一致。",
      "二号的认知被修改过，床上的人也主动清除了自己的记忆。",
      "床上的人就是杀死主人、取代主人生活的一号；纸条原本是主人留下的警告。"
    ],
    "difficulty": "hard"
  },
  {
    "id": "real-silent-boyfriend",
    "title": "沉默的男友",
    "category": "本格",
    "story": "我和男朋友通话，他突然不说话了，之后发生的事令我毛骨悚然。",
    "answer": "我躺在床上和男朋友视频通话，不小心把手机掉到了地上。捡起来时，男朋友脸色大变，把手指抵在嘴唇上，示意我别出声，随后给我发来一条消息：\"你床底下有人。\"",
    "hints": [
      "他们进行的是视频通话。",
      "手机曾掉在地上，拍到了平常看不见的位置。",
      "男友从镜头里看见了床下藏着的人，才不敢出声提醒。"
    ],
    "difficulty": "easy"
  },
  {
    "id": "real-people-on-the-boat",
    "title": "船上人数之谜",
    "category": "本格",
    "story": "第一天，哈里说船上有六个人。第三天，他说只剩两个人。第五天，他说只剩自己。第七天，救援船靠过去，渔民看见艇里的两个人，立刻报了警。",
    "answer": "哈里驾驶帆船，带妻子和另外一家四口出海，起初共有六个人。夜里的海难让帆船沉没，只有哈里和一个小女孩爬上救生艇。小女孩后来也死了，哈里说“只剩自己”，指的是艇上只剩一个活人；女孩的遗体一直在艇里。缺乏食物的哈里最终把遗体当作食物。渔民救援时看见的“两个人”，是哈里和那具残缺的女孩遗体。前面几次人数来自哈里对幸存者的描述，最后一次来自救援者眼前的景象。",
    "hints": [
      "前几次是船长在说还活着的人数，最后一次来自救援者的观察。",
      "小女孩死亡以后，身体仍留在救生艇上。",
      "救援者看见一个活人和被当作食物的女孩遗体，才报了警。"
    ],
    "difficulty": "medium"
  },
  {
    "id": "real-voice-at-the-window",
    "title": "窗边的声音",
    "category": "变格",
    "story": "小时候，我被锁在海边的小屋里。每逢涨潮，总有个男人在窗外陪我说话，他从不进屋。后来我成了女王，吃了大半辈子同一道菜。直到有一天，盘子里的一小块皮，让我撤掉了寻找他的悬赏。",
    "answer": "窗外的男人是一条人鱼。人鱼趁涨潮游到小屋窗边，陪被囚禁的我说话。我见过人鱼的脸，也记得窗外的男人搭在窗台上的手腕有一片雪花形的白色花纹，却一直没见过人鱼的下半身。离开小屋后，我再也没有找到人鱼。这个世界里，人鱼肉能使人长生；后来我成了女王，下令捕杀人鱼，每天靠人鱼肉续命，盼着有一天能等到窗外的男人。多年后，送上来的菜里留着一小块带皮的腕肉，皮上正是我记了一辈子的花纹。我终于找到了人鱼。",
    "hints": [
      "窗外的人只能在涨潮时靠近小屋，这与他的身体有关。",
      "女王吃那道菜是为了长生，她想一直等到那个人出现。",
      "菜是人鱼肉，皮上的花纹来自那个人的手腕。"
    ],
    "difficulty": "medium"
  },
  {
    "id": "real-great-treasure",
    "title": "大宝贝",
    "category": "本格",
    "story": "一个流浪汉今天捡到了一个大宝贝。犹豫再三，他还是没忍住，拿着宝贝去换钱。那个回收员看着宝贝说了一句：\"这枚戒指，你是从哪里捡来的？\"流浪汉以为自己完蛋了，结果那个回收员崩溃了。",
    "answer": "流浪汉捡到一根戴着戒指的断指，犹豫很久，还是取下戒指拿去换钱。回收员看见戒指就追问来历，流浪汉以为回收员要把自己当成伤人犯，吓得说出了断指的事。没想到回收员听完反而崩溃了：这枚戒指与回收员手上的那枚是一对，是送给男友的定情礼物。断指原本属于那位男友。",
    "hints": [
      "流浪汉拿去换钱的是一枚戒指。",
      "戒指被捡到时，还戴在某人的断指上。",
      "回收员认出那是自己送给男友的戒指，追问才得知断指的事。"
    ],
    "difficulty": "medium"
  },
  {
    "id": "real-second-robbery",
    "title": "第二次打劫",
    "category": "本格",
    "story": "我是超市的一名打工收银员。今天超市被打劫了，我很庆幸自己活了下来。事件过了一个月后，我见到了当初打劫的那批人，依稀听见他们准备再抢一次。隔天，\"劫匪\"又来了。这次老板早有准备，拿出一把枪，把劫匪全都击毙了。可我却不再庆幸自己活了下来。",
    "answer": "打劫事件过了一个月后，\"我\"又遇见了当初那批劫匪。我很纳闷，这批人竟然平安无事，还在谋划着继续抢劫别的地方。于是我也动起了歪脑筋：急忙回家通知家人，准备一起抢劫我打工的那家超市，捞一笔钱补贴不富裕的家。万万没想到，上一次被抢之后，老板早就有了防备——这一次老板拿出了枪，倒在枪下的\"劫匪\"，全都是我的家人。没了家人，我也不想活了，所以我不再庆幸自己活了下来。",
    "hints": [
      "第二次上门的劫匪与第一次不同。",
      "收银员参与安排了第二次抢劫。",
      "第二次被老板击毙的，是收银员叫来抢劫的家人。"
    ],
    "difficulty": "medium"
  },
  {
    "id": "real-seventh-night-call",
    "title": "第七天的电话",
    "category": "本格",
    "story": "奶奶去世后，我每天晚上都会给她打一个电话。前六天，电话一直响到我挂断；第七天，电话接通了。听到电话里传来的声音后，我慌了，立刻赶回那间早就空了的老屋。门打开时，我救下了一个本不该在那里的人。",
    "answer": "奶奶生前一直和爷爷住在老屋。爷爷记性不好，奶奶平时出门买菜，常打家里的座机提醒爷爷关火、吃药、锁门。奶奶去世后，家人把爷爷接走了，老屋空了下来，但座机一直没有停机。我太想奶奶，每天晚上都会拨那个号码——我知道不会有人接，只是想再听一会儿铃声。前六天，电话一直没人接。第七天晚上，铃声响了很久之后，电话忽然接通了：那头没有奶奶的声音，我先听到一阵刺耳的滴滴声——那是老屋厨房里的燃气警报器；接着又听到爷爷含糊地喊着奶奶的名字。我立刻明白出事了。原来那天傍晚，爷爷趁家人不注意，糊里糊涂地回到了老屋。爷爷以为奶奶还在，烧上水想等奶奶回家，却忘了关燃气。警报器响起后爷爷慌得不知所措，就在这时，座机响了——爷爷以为是奶奶像从前一样打来电话提醒，便接起了电话。我马上报警，又赶回老屋，爷爷最终获救了。电话接通的那一刻，我并不害怕：那不是奶奶回来了，是爷爷还在等奶奶。奶奶留下的习惯，最后一次救了爷爷。",
    "hints": [
      "接电话的人仍然活着，电话里的另一种声音更要紧。",
      "爷爷回到了已经搬空的老屋，厨房出了危险。",
      "来电习惯让爷爷接起了电话，孙辈听见警报和他的声音，及时求助救人。"
    ],
    "difficulty": "easy"
  },
  {
    "id": "real-tumbling-dream",
    "title": "翻滚的梦",
    "category": "变格",
    "story": "我梦到自己不停地上下翻滚，耳边仿佛有风猎猎作响。过了几天，我去探亲，路过一个独居男人的农庄，他正在擦一只笼子。他瞥见我之后，却吓得大惊失色。",
    "answer": "我有一个双胞胎妹妹，长大后我们天各一方。双胞胎心有灵犀，那个上下翻滚、风声猎猎的诡异梦境令我十分不安，于是我动身去探望妹妹。这个故事里，双胞胎之间的感应能传来另一人身体遭遇的片段。我梦见的翻滚，是妹妹的遗体被狗拖拽、甩动；呼呼作响的声音，则是狗贴近时的喘息。独居男人正是凶手：男人杀死了妹妹，把尸体交给自家的狗吃掉，借此处理尸体；狗吃完这些骨肉花了几天，之后男人连狗也处理掉了。男人正在清理笼子上的血迹时，忽然看见\"被害者\"又一次出现在自己眼前——来的是和妹妹长得一模一样的我，男人因此吓得大惊失色。",
    "hints": [
      "梦境与我分开生活的双胞胎妹妹有关。",
      "男人见到的是与自己杀害的人长得一模一样的姐姐。",
      "梦里感应到的是妹妹遗体被狗拖拽甩动；清洗笼子的男人正是凶手。"
    ],
    "difficulty": "medium"
  },
  {
    "id": "real-as-if-possessed",
    "title": "仿佛中邪",
    "category": "本格",
    "story": "女主播进了闹鬼的废弃医院，直播很快中断。监控里，一个穿着她那身衣服的人跌跌撞撞跑出来，冲到码头，把石头绑在腿上跳进海里。几天后，警方找到了女主播的尸体。",
    "answer": "女主播在医院撞见黑帮交易，被杀害了。为了把案件伪装成探险后精神失常投海，一名同伙穿上女主播的衣服，沿监控能拍到的路线表演逃跑和跳海。这名同伙入水后脱掉绑缚，游向事先等候的接应船，离开了监控范围。随后同伙把真正的女主播遗体抛入海中。警方发现的尸体属于女主播，监控里的跳海者却是另一个人。",
    "hints": [
      "进医院与离开医院的人，需要分开确认身份。",
      "逃到海边的那个人能够在跳水后脱身。",
      "主播已在医院遇害；同伙穿着她的衣服表演跳海，随后真正尸体才被抛入海中。"
    ],
    "difficulty": "medium"
  },
  {
    "id": "real-useless-power",
    "title": "废物能力",
    "category": "变格",
    "story": "整条街又停住了。这个能力什么都好，就是从不听我使唤。我慢悠悠地穿过人群，忽然有人伸手抓住了我。他比我还吃惊：“你怎么还能动？”",
    "answer": "我一直以为自己拥有无法控制发动时机的时间暂停能力：周围偶尔会突然静止，而我可以自由行动。其实真正的能力者住在附近，时间每次都是被他暂停的，我的能力只是免受时停影响。这一次，他正在静止的街上杀人，我走进了他的视线。他原以为暂停期间不会有目击者，发现我还能行动，便来抓我。我拼命试着让时间恢复，却什么也做不了。直到这时，我才明白自己一直认错了能力。",
    "hints": [
      "街上确实发生了时间暂停，我也确实能在其中行动。",
      "能在暂停的时间里活动，不代表能让时间暂停。",
      "发动时停的是抓住他的人，他自己的能力仅仅是免疫时停。"
    ],
    "difficulty": "medium"
  },
  {
    "id": "real-breakup-call",
    "title": "分手电话",
    "category": "本格",
    "story": "\"我们分手吧，我爸爸不同意我们在一起。\"\n从那以后，我们很久都没有再联系。\n直到那个日子，我看见了某样东西，痛哭不止。",
    "answer": "我和女友刚在一起的时候，女友曾和我约定：如果以后遇到了危险，就打电话跟我说一些特别离谱的话，让我赶紧去救女友或者报警。当时我只当是玩笑话。有一天我接到女友的电话，女友说\"我们分手吧，我爸爸不同意我们在一起\"，我还没问出究竟，电话就挂断了。我万念俱灰，此后打电话女友不接，发消息也没有回应，我们就此失去联系。几年后的清明节，我去公墓给爷爷扫墓，却在那里发现了女友的墓碑，而一旁女友父亲的墓碑上刻着的去世时间，远早于女友给我打电话的那天。我这才想起女友曾说过，女友的父亲几年前就已经去世了。我终于明白，那通电话里的\"离谱分手\"正是约定的求救信号，女友当时正身处险境，而我没能察觉——女友是被人杀死的。我为那天没能救下女友而痛哭不止。",